{
  "baseline_artifact": "docs/sm86_accuracy_campaign_v1_predictions_pre_ncu.json",
  "causal_claim": false,
  "contrast_summaries": [
    {
      "causal_claim": false,
      "consistency_status": "consistent_observational_contrast",
      "id": "cache_none_all_workloads",
      "interpretation": "observational_direction_and_metric_consistency_only",
      "mechanism_counter_directions": {
        "dram__sectors_read.sum": {
          "decrease": 13,
          "increase": 2
        },
        "dram__sectors_write.sum": {
          "increase": 15
        },
        "gpu__time_duration.sum": {
          "decrease": 13,
          "increase": 2
        },
        "sm__cycles_active.max": {
          "decrease": 13,
          "increase": 2
        },
        "smsp__inst_executed.sum": {
          "no_change": 15
        }
      },
      "mechanism_counters_available": true,
      "simulator_projection_invariant": true,
      "target_direction_counts": {
        "decrease": 13,
        "increase": 2
      },
      "variable": "cache_policy",
      "workload_count": 15
    },
    {
      "causal_claim": false,
      "consistency_status": "consistent_observational_contrast",
      "id": "clock_base_two_family_cases",
      "interpretation": "observational_direction_and_metric_consistency_only",
      "mechanism_counter_directions": {
        "dram__sectors_read.sum": {
          "increase": 1,
          "no_change": 1
        },
        "dram__sectors_write.sum": {
          "decrease": 1,
          "increase": 1
        },
        "gpu__time_duration.sum": {
          "decrease": 2
        },
        "sm__cycles_active.max": {
          "increase": 2
        },
        "smsp__inst_executed.sum": {
          "no_change": 2
        }
      },
      "mechanism_counters_available": true,
      "simulator_projection_invariant": true,
      "target_direction_counts": {
        "increase": 2
      },
      "variable": "clock_control",
      "workload_count": 2
    }
  ],
  "interpretation": "observational_direction_and_metric_consistency_only",
  "metrics": [
    "gpc__cycles_elapsed.max",
    "gpu__time_duration.sum",
    "sm__cycles_active.max",
    "smsp__inst_executed.sum",
    "dram__sectors_read.sum",
    "dram__sectors_write.sum"
  ],
  "prediction_before_observation": true,
  "rows": [
    {
      "baseline_all_cache": {
        "median": {
          "dram__sectors_read.sum": 2300.0,
          "dram__sectors_write.sum": 0.0,
          "gpc__cycles_elapsed.max": 13076.0,
          "gpu__time_duration.sum": 9.728,
          "sm__cycles_active.max": 11174.0,
          "smsp__inst_executed.sum": 47136.0
        },
        "samples": {
          "dram__sectors_read.sum": [
            2300.0,
            2300.0,
            2300.0,
            2300.0,
            2300.0
          ],
          "dram__sectors_write.sum": [
            0.0,
            0.0,
            4.0,
            16.0,
            0.0
          ],
          "gpc__cycles_elapsed.max": [
            13214.0,
            13026.0,
            13031.0,
            13121.0,
            13076.0
          ],
          "gpu__time_duration.sum": [
            9.824,
            9.664,
            9.664,
            9.76,
            9.728
          ],
          "sm__cycles_active.max": [
            11333.0,
            11146.0,
            11168.0,
            11256.0,
            11174.0
          ],
          "smsp__inst_executed.sum": [
            47136.0,
            47136.0,
            47136.0,
            47136.0,
            47136.0
          ]
        }
      },
      "contrasts": {
        "cache_none": {
          "delta_vs_all_cache": {
            "dram__sectors_read.sum": -248.0,
            "dram__sectors_write.sum": 216.0,
            "gpc__cycles_elapsed.max": -480.0,
            "gpu__time_duration.sum": -0.3520000000000003,
            "sm__cycles_active.max": -455.0,
            "smsp__inst_executed.sum": 0.0
          },
          "direction_vs_all_cache": {
            "dram__sectors_read.sum": "decrease",
            "dram__sectors_write.sum": "increase",
            "gpc__cycles_elapsed.max": "decrease",
            "gpu__time_duration.sum": "decrease",
            "sm__cycles_active.max": "decrease",
            "smsp__inst_executed.sum": "no_change"
          },
          "median": {
            "dram__sectors_read.sum": 2052.0,
            "dram__sectors_write.sum": 216.0,
            "gpc__cycles_elapsed.max": 12596.0,
            "gpu__time_duration.sum": 9.376,
            "sm__cycles_active.max": 10719.0,
            "smsp__inst_executed.sum": 47136.0
          },
          "samples": {
            "dram__sectors_read.sum": [
              2348.0,
              2052.0,
              1992.0,
              2336.0,
              2036.0
            ],
            "dram__sectors_write.sum": [
              232.0,
              112.0,
              412.0,
              172.0,
              216.0
            ],
            "gpc__cycles_elapsed.max": [
              13169.0,
              12525.0,
              12596.0,
              13280.0,
              12488.0
            ],
            "gpu__time_duration.sum": [
              9.792,
              9.312,
              9.376,
              9.888,
              9.28
            ],
            "sm__cycles_active.max": [
              11294.0,
              10644.0,
              10719.0,
              11425.0,
              10645.0
            ],
            "smsp__inst_executed.sum": [
              47136.0,
              47136.0,
              47136.0,
              47136.0,
              47136.0
            ]
          }
        },
        "clock_base": {
          "delta_vs_all_cache": {
            "dram__sectors_read.sum": 0.0,
            "dram__sectors_write.sum": 8.0,
            "gpc__cycles_elapsed.max": 1505.0,
            "gpu__time_duration.sum": -0.3200000000000003,
            "sm__cycles_active.max": 1159.0,
            "smsp__inst_executed.sum": 0.0
          },
          "direction_vs_all_cache": {
            "dram__sectors_read.sum": "no_change",
            "dram__sectors_write.sum": "increase",
            "gpc__cycles_elapsed.max": "increase",
            "gpu__time_duration.sum": "decrease",
            "sm__cycles_active.max": "increase",
            "smsp__inst_executed.sum": "no_change"
          },
          "median": {
            "dram__sectors_read.sum": 2300.0,
            "dram__sectors_write.sum": 8.0,
            "gpc__cycles_elapsed.max": 14581.0,
            "gpu__time_duration.sum": 9.408,
            "sm__cycles_active.max": 12333.0,
            "smsp__inst_executed.sum": 47136.0
          },
          "samples": {
            "dram__sectors_read.sum": [
              2300.0,
              2300.0,
              2380.0,
              2444.0,
              2300.0
            ],
            "dram__sectors_write.sum": [
              0.0,
              4.0,
              12.0,
              172.0,
              8.0
            ],
            "gpc__cycles_elapsed.max": [
              14529.0,
              14581.0,
              14614.0,
              14582.0,
              14519.0
            ],
            "gpu__time_duration.sum": [
              9.376,
              9.408,
              9.408,
              9.408,
              9.344
            ],
            "sm__cycles_active.max": [
              12330.0,
              12333.0,
              12387.0,
              12382.0,
              12282.0
            ],
            "smsp__inst_executed.sum": [
              47136.0,
              47136.0,
              47136.0,
              47136.0,
              47136.0
            ]
          }
        }
      },
      "workload": "base__embedding_gather_int32_sm80"
    },
    {
      "baseline_all_cache": {
        "median": {
          "dram__sectors_read.sum": 1636.0,
          "dram__sectors_write.sum": 0.0,
          "gpc__cycles_elapsed.max": 15924.0,
          "gpu__time_duration.sum": 11.84,
          "sm__cycles_active.max": 14025.0,
          "smsp__inst_executed.sum": 39568.0
        },
        "samples": {
          "dram__sectors_read.sum": [
            2252.0,
            1596.0,
            12292.0,
            1636.0,
            1596.0
          ],
          "dram__sectors_write.sum": [
            0.0,
            0.0,
            0.0,
            24.0,
            0.0
          ],
          "gpc__cycles_elapsed.max": [
            15961.0,
            15918.0,
            16042.0,
            15924.0,
            15906.0
          ],
          "gpu__time_duration.sum": [
            11.872,
            11.84,
            11.936,
            11.84,
            11.84
          ],
          "sm__cycles_active.max": [
            14025.0,
            14011.0,
            14119.0,
            14033.0,
            13999.0
          ],
          "smsp__inst_executed.sum": [
            39568.0,
            39568.0,
            39568.0,
            39568.0,
            39568.0
          ]
        }
      },
      "contrasts": {
        "cache_none": {
          "delta_vs_all_cache": {
            "dram__sectors_read.sum": -1560.0,
            "dram__sectors_write.sum": 272.0,
            "gpc__cycles_elapsed.max": -1906.0,
            "gpu__time_duration.sum": -1.4079999999999995,
            "sm__cycles_active.max": -1906.0,
            "smsp__inst_executed.sum": 0.0
          },
          "direction_vs_all_cache": {
            "dram__sectors_read.sum": "decrease",
            "dram__sectors_write.sum": "increase",
            "gpc__cycles_elapsed.max": "decrease",
            "gpu__time_duration.sum": "decrease",
            "sm__cycles_active.max": "decrease",
            "smsp__inst_executed.sum": "no_change"
          },
          "median": {
            "dram__sectors_read.sum": 76.0,
            "dram__sectors_write.sum": 272.0,
            "gpc__cycles_elapsed.max": 14018.0,
            "gpu__time_duration.sum": 10.432,